{
  "artifact_type": "studio_dossier",
  "dossier_id": "studio-dossier-stress-002",
  "title": "Handoff-Readout mit Approval-Verwechslungsrisiko",
  "topic": "bounded handoff packet for later human decision review stays non-approving and conflict-visible",
  "dossier_scope": "local_human_review_only",
  "included_artifacts": [
    {
      "artifact_type": "handoff_artifact",
      "ref": "examples/studio/scenarios/idea-to-handoff/handoff.artifact.json"
    },
    {
      "artifact_type": "gate_report",
      "ref": "examples/studio/scenarios/idea-to-handoff/gate-report.handoff.json"
    },
    {
      "artifact_type": "studio_intake_packet",
      "ref": "examples/studio/scenarios/idea-to-handoff/intake.packet.json"
    },
    {
      "artifact_type": "review_record",
      "ref": "examples/studio/scenarios/idea-to-handoff/review-record.forward.json"
    }
  ],
  "source_packet_ref": "examples/studio/scenarios/idea-to-handoff/intake.packet.json",
  "source_packet_summary": "Das Dossier ist absichtlich knapp und handoff-nah. Die Stressfrage ist, ob spätere Leser bounded Weitergabe mit impliziter Zustimmung verwechseln.",
  "included_proposal_refs": [
    "examples/studio/scenarios/idea-to-handoff/handoff.artifact.json"
  ],
  "review_refs": [
    "examples/studio/scenarios/idea-to-handoff/review-record.forward.json"
  ],
  "gate_report_refs": [
    "examples/studio/scenarios/idea-to-handoff/gate-report.handoff.json"
  ],
  "bundle_context_summary": "Kein Bundle-Manifest. Die Lesefläche bleibt ein lokaler Relay-Satz und darf nicht wie Freigabe oder Abschluss klingen.",
  "open_conflicts": [
    "the threshold for escalation remains disputed",
    "The escalation threshold remains contested and must stay visible."
  ],
  "gate_outcomes": [
    {
      "gate_report_id": "gate-idea-handoff-001",
      "gate_name": "handoff_quality_gate",
      "gate_outcome": "pass",
      "subject_ref": "examples/studio/scenarios/idea-to-handoff/handoff.artifact.json",
      "approval_requirement": "required_before_forward"
    }
  ],
  "recommended_human_next_step": "request_human_decision",
  "forbidden_automated_next_steps": [
    "runtime_review_object_creation",
    "truth_mutation",
    "card_write",
    "index_write",
    "alias_write",
    "auto_forwarding",
    "provider_execution"
  ],
  "proposal_only": true,
  "no_truth_mutation": true,
  "no_runtime_write": true,
  "notes": "Stress focus: versteckte Grenzverwischung. Forward-Readout darf nicht in Approval-Lesart kippen, obwohl die Oberfläche knapp und sauber ist."
}
