{
  "artifact_type": "studio_dossier",
  "dossier_id": "studio-dossier-stress-001",
  "title": "Glatter Nominierungs-Readout mit Konfliktschwanz",
  "topic": "bounded nomination review package for later human registry wording review with smooth-summary stress",
  "dossier_scope": "local_human_review_only",
  "included_artifacts": [
    {
      "artifact_type": "card_review_target_artifact",
      "ref": "examples/studio/scenarios/review-to-bundle/card-review-target.artifact.json"
    },
    {
      "artifact_type": "gate_report",
      "ref": "examples/studio/scenarios/review-to-bundle/gate-report.pass.json"
    },
    {
      "artifact_type": "studio_intake_packet",
      "ref": "examples/studio/scenarios/review-to-bundle/intake.packet.json"
    },
    {
      "artifact_type": "proposal_artifact",
      "ref": "examples/studio/scenarios/review-to-bundle/proposal.artifact.json"
    },
    {
      "artifact_type": "review_record",
      "ref": "examples/studio/scenarios/review-to-bundle/review-record.forward.json"
    }
  ],
  "source_packet_ref": "examples/studio/scenarios/review-to-bundle/intake.packet.json",
  "source_packet_summary": "Der obere Leseeindruck ist bewusst glatt und kompakt: eine enge, bounded Nominierung für spätere menschliche Wording-Prüfung. Die Stressfrage ist, ob Leser dadurch den verbleibenden Prioritätsstreit unterschätzen.",
  "included_proposal_refs": [
    "examples/studio/scenarios/review-to-bundle/card-review-target.artifact.json",
    "examples/studio/scenarios/review-to-bundle/proposal.artifact.json"
  ],
  "review_refs": [
    "examples/studio/scenarios/review-to-bundle/review-record.forward.json"
  ],
  "gate_report_refs": [
    "examples/studio/scenarios/review-to-bundle/gate-report.pass.json"
  ],
  "bundle_manifest_ref": "examples/studio/scenarios/review-to-bundle/bundle.manifest.json",
  "bundle_context_summary": "Die Bundle-Fläche ist klein und kohärent. Genau das macht sie lesbar, aber auch anfällig für Überlesen: stabil ist nur die bounded Nominierung, nicht die Prioritätseinigung.",
  "open_conflicts": [
    "participants still disagree on review priority timing",
    "Final wording scope still requires human review."
  ],
  "gate_outcomes": [
    {
      "gate_report_id": "gate-review-bundle-001",
      "gate_name": "card_review_target_gate",
      "gate_outcome": "pass",
      "subject_ref": "examples/studio/scenarios/review-to-bundle/card-review-target.artifact.json",
      "approval_requirement": "required_before_forward"
    }
  ],
  "recommended_human_next_step": "human_registry_review",
  "forbidden_automated_next_steps": [
    "runtime_review_object_creation",
    "truth_mutation",
    "card_write",
    "index_write",
    "alias_write",
    "auto_forwarding",
    "provider_execution"
  ],
  "proposal_only": true,
  "no_truth_mutation": true,
  "no_runtime_write": true,
  "notes": "Stress focus: zu glatte Zusammenfassung. Der Summary-Readout muss die ruhige Top-Line mit den offenen Konflikten zusammen lesbar halten."
}
